"","Acronym","Meaning","Definition"
"263","FRAM","Fishery Regulation Assessment Model","Typically used for salmon."
"264","FRFA","Final Regulatory Flexibility Analysis",NA
"265","FTE","Full time employee",NA
"266","FWC","Florida Fish and Wildlife Conservation Commission",NA
"267","FWRI","Fish and Wildlife Research Institute","Integrates research activities with management efforts of other FWC divisions to provide information to protect, conserve and manage Florida's fish and wildlife resources"
"268","FWS","United States Fish and Wildlife Service","United States Fish and Wildlife Service"
"269","FX%",NA,"The rate of fishing mortality that will reduce female spawning biomass per recruit to x percent of its unfished level. F100% is zero, and F35% is a reasonable proxy for FMSY. (All figures after ""F"" should be subscript.)"
"270","Fm","Fathom","Six feet."
"271","GAC","Global Area Coverage",NA
"272","GAM","General Additive Models",NA
"273","GAO","General Accounting Office",NA
"274","GAP","Groundfish Advisory Subpanel","The Council established the GAP to obtain the input of the people most affected by, or interested in, the management of the groundfish fishery. This advisory body is made up of representatives with recreational, trawl, fixed gear, open access, tribal, environmental, and processor interests. Their advice is solicited when preparing fishery management plans, reviewing plans before sending them to the Secretary, reviewing the effectiveness of plans once they are in operation, and developing annual and inseason management."
"275","GARFO","Greater Atlantic Regional Fisheries Office",NA
"276","GARM","Groundfish Assessment Review Committee","The federal stock assessment review committee that evaluates groundfish assessements, such as winter flounder."
"277","GB","Georges Bank",NA
"278","GBK","Georges Bank","A region used to describe a population segment of the American lobster resource."
"279","GDP","Gross Domestic Product",NA
"280","GEMPAC","Ad Hoc Groundfish Electronic Monitoring Policy Advisory Committee",NA
"281","GEMTAC","Ad hoc Groundfish Electronic Monitoring Technical Advisory Committee",NA
"282","GESW","Groundfish Endangered Species Workgroup",NA
"283","GF","Groundfish",NA
"284","GFCA","Guam Fishermen's Cooperative Association",NA
"285","GFNMS","Gulf of the Farallones National Marine Sanctuary",NA
"286","GHL","Guideline Harvest Level",NA
"287","GIS","Geographic Information System",NA
"288","GKC","Golden King Crab",NA
"289","GLFC","Great Lakes Fishery Commission","Established in 1955 by the Canadian/U.S. Convention on Great Lakes Fisheries, the Commission coordinates fisheries research, controls the invasive sea lamprey, and facilitates cooperative fishery management among the state, provincial, tribal, and federal management agencies."
"290","GM","Genetically Modified",NA
"291","GMFMC","Gulf of Mexico Fishery Management Council",NA
"292","GMT","Groundfish Management Team","Groundfish management plans and annual and inseason management recommendations are prepared by the Council's GMT, which consists of scientists and managers with specific technical knowledge of the groundfish fishery."
"293","GNI","Gross National Income",NA
"294","GNP","Gross National Product",NA
"295","GOA","Gulf of Alaska",NA
"296","GODAS","Global Ocean Data Assimilation System",NA
"297","GOES","Geostationary Operational Environmental Satellites",NA
"298","GOM","Gulf of Maine","Used to describe population segments for both American lobster and winter flounder."
"299","GPS","global positioning system",NA
"300","GRFS","Gulf Reef Fish Survey","Florida's supplemental state survey for certain species of reef fish from 2015 to June of 2020. Replaced by SRFS"
"301","GRSC","Great Red Snapper Count",NA
"302","GRT","Gross Registered Tonnes",NA
"303","GSMFC","Gulf States Marine Fisheries Commission",NA
"304","Gulf","Gulf of Mexico",NA
"305","Gulf Council","Gulf of Mexico Fishery Management Council",NA
"306","GulfFIN","Gulf of Mexico Fisheries Information Network",NA
"307","HACCP","Hazard Analysis and Critical Control Points",NA
"308","HAPC","Habitat areas of particular concern","Subsets of essential fish habitat (see EFH) containing particularly sensitive or vulnerable habitats that serve an important ecological function, are particularly sensitive to human-induced environmental degradation, are particularly stressed by human development activities, or comprise a rare habitat type."
"309","HBS","Headboat Survey",NA
"310","HC","Habitat Committee","An ASMFC committee that provides advice on issues related to habitat, habitat management, habitat requirements by the managed species, enforceability of proposed habitat management measures."
"311","HCR","Harvest control rule",NA
"312","HDAR","Hawaii Division of Aquatic Resources",NA
"313","HG","Harvest guideline(s)","A numerical harvest level that is a general objective, but not a quota. Attainment of a harvest guideline does not require a management response, but it does prompt review of the fishery."
"314","HLF","Hawaii Longline Fishery",NA
"315","HMRFS","Hawaii Marine Recreational Fishing Survey",NA
"316","HMS","Highly migratory species","In the Council context, highly migratory species in the Pacific Ocean include species managed under the HMS Fishery Management Plan: tunas, sharks, billfish/swordfish, and dorado or dolphinfish."
"317","HMS FMP","Highly Migratory Species Fishery Management Plan","This is the fishery management plan (and its subsequent revisions) for the Washington, Oregon, and California Highly Migratory Species Fisheries developed by the PFMC and approved by the Secretary of Commerce."
"318","HMSAS","Highly Migratory Species Advisory Subpanel",NA
"319","HMSMT","Highly Migratory Species Management Team",NA
"320","HMSPDT","Highly Migratory Species Plan Development Team",NA
"321","HOT","Hawaii Ocean Time Series",NA
"322","HP","Horsepower",NA
"323","HSTT","Hawaii-Southern California Training and Testing",NA
"324","IA","interim analysis",NA
"325","IATTC","Inter-American Tropical Tuna Commission",NA
"326","IBA","Individual Bycatch Accounting",NA
"327","IBQ","Individual bycatch quota","IBQs are used to control the catch of prohibited species."
"328","ICA","Inter-cooperative Agreements",NA
"329","ICC","Intergovernmental Consultive Committee",NA
"330","ID","Identification",NA
"331","ID","Stock identification process",NA
"332","IDFG","Idaho Department of Fish and Game",NA
"333","IEA","Integrated Ecosystem Assessment",NA
"334","IFA","Interjurisdictional Fisheries Act","Federal legislation that provides funding to the three Interstate Fisheries Commissions to support management of interjurisdictional fishery resources."
"335","IFP","International Fisheries Program",NA
"336","IFQ","individual fishing quota",NA
"337","INPFC","International North Pacific Fishery Commission",NA
"338","IOOS","Integrated Ocean Observing System",NA
"339","IPA","Incentive Plan (Program) Agreements",NA
"340","IPCC","International Panel on Climate Change",NA
"341","IPHC","International Pacific Halibut Commission","A Commission responsible for studying Pacific halibut stocks and the halibut fishery. The IPHC makes proposals to the U.S. and Canada concerning the regulation of the halibut fishery."
"342","IPQ","Individual Processor Quotas",NA
"343","IPT","Interdisciplinary Plan Team",NA
"344","IQ","Individual quota",NA
"345","IQF","Individually quick frozen",NA
"346","IRFA","Initial Regulatory Flexibility Analysis",NA
"347","IRIU","Improved retention/improved utilization",NA
"348","ISC","International Scientific Committee",NA
"349","ISC","International Scientific Committee for Tuna and Tuna-like Species in the North Pacific Ocean",NA
"350","ISFMP","Interstate Fisheries Management Program","An ASMFC program dedicated to the development and maintenance of interstate fisheries management plans for 22 species groups."
"351","ISTC","Interstate Shellfish Transport Committee","An ASMFC committee, composed of shellfish technical representatives from each of the 15 states, District of Columbia, Potomac River Fisheries Commission, National Marine Fisheries Service, and U.S. Fish and Wildlife Service, that is tasked with evaluating issues related to the introduction of non-native shellfish to support new commercial fisheries in Atlantic coastal waters."
"352","ITC","Interstate Tagging Committee","An ASMFC committee that focuses on improving the quality and utility of data collected by scientific and angler- based tagging programs."
"353","ITCZ","Inter-Tropical Convergence Zone",NA
"354","ITQ","Individual transferable (or tradeable) quota","A type of quota (a part of a total allowable catch) allocated to individual fishermen or vessel owners and which can be transferred (sold, leased) to others."
"355","ITQ","Individual transferable quota",NA
"356","ITS","incidental take statement",NA
"357","IUCN","International Union for the Conservation of Nature",NA
"358","IUU","Illegal, unregulated, and unreported",NA
"359","Int","International landings",NA
"360","JAI","Juvenile abundance index","A measure of the relative abundance of juveniles in a stock that may serve as an indication of reproductive success. For some species, the JAI may predict future adult abundance."
"361","JAM","Jeopardy or adverse modification",NA
"362","K","time constant",NA
"363","K-A","Korean-American",NA
"364","KBRA","Klamath Basin Restoration Agreement",NA
"365","KMZ","Klamath management zone","Ocean zone between Humbug Mountain and Horse Mountain where management emphasis is on Klamath River fall Chinook."
"366","KRFC","Klamath River fall Chinook",NA
"367","L MAX","maximum length",NA
"368","LAA","Likely to adversely affect",NA
"369","LAMP","Local Area Management Plan",NA
"370","LAPP","limited access privilege program",NA
"371","LC","Legislative Committee",NA
"372","LCN","Lingcod - North",NA
"373","LCN","Lower Columbia natural",NA
"374","LCR","Lower Columbia River",NA
"375","LCS","Lingcod - South",NA
"376","LDWF","Louisiana Department of Wildlife and Fisheries","Louisiana's state agency for freshwater and saltwater resources"
"377","LE","Limited entry fishery","A fishery for which a fixed number of permits have been issued in order to limit participation."
"378","LEAP","Law Enforcement Advisory Panel",NA
"379","LEC","Law Enforcement Committee","An ASMFC committee which provides advice on issues related to law enforcement and enforceability of potential management measures, comprised of representatives of each member state, Washington, D.C., National Marine Fisheries Service, U.S. Fish and Wildlife Service, and the U.S. Coast Guard."
"380","LEI","Long-term effect index",NA
"381","LK","Local Knowledge",NA
"382","LLP","License limitation program",NA
"383","LNG","Liquified natural gas",NA
"384","LOA","Length overall",NA
"385","LOC","Letter of Concurrence",NA
"386","LOF","List of Fisheries",NA
"387","LPS","Large Pelagics Survey","a specialized survey conducted from Maine to Virginia that collects catch and effort data for tuna, sharks, billfishes, swordfish and other offshore recreational species"
"388","LRP","limit reference point","a type of biological reference point; point at which status of fishery will decline or collapse"
"389","LVPA","Large Vessel Protected Area",NA
"390","M","Natural Mortality","The instantaneous rate at which fish die from all causes other than harvest. Typically includes unmeasured bycatch. M is very difficult to measure."
"391","M","instantaneous natural mortality rate",NA
"392","M","Natural mortality rate",NA
"393","M&SI","Mortality and Serious Injury",NA
"394","MA","Massachusetts",NA
"395","MA","Massachusetts Division of Marine Fisheries",NA
"396","MAB","Mid-Atlantic Bight",NA
"397","MAFMC","Mid-Atlantic Fishery Management Council","One of eight regional fishery management councils established by the Magnuson Act that are responsible for management of fisheries in federal waters (3-200 miles from shore)."
"398","MARMAP","Marine Resources Monitoring Assessment and Prediction Program",NA
"399","MBNMS","Monterey Bay National Marine Sanctuary",NA
"400","MBTA","Migratory Bird Treaty Act",NA
"401","MC","Monitoring Committee",NA
"402","MCA","Maximum Commerce Amount",NA
"403","MCD","Marine Conservation District",NA
"404","MD","Maryland",NA
"405","MDMR","Mississippi Department of Marine Resources","state of Mississippi's marine resources agency"
"406","ME","DMR Maine Department of Marine Resources",NA
"407","ME","Maine",NA
"408","ME","McCracken Estimates",NA
"409","MEI","Multivariate ENSO Index",NA
"410","MEW","Model Evaluation Workgroup (for salmon)",NA
"411","MEY","maximum economic yield",NA
"412","MFCMA","Magnuson Fishery Conservation and Management Act","The Fishery Conservation and Management Act was renamed the ""Magnuson Fishery Conservation and Management Act"" in 1980. The MFCMA established the 200-mile fishery conservation zone and the regional fishery management council system."
"413","MFMT","Maximum fishing mortality threshold","A limit identified in the National Standard Guidelines. A fishing mortality rate above this threshold constitutes overfishing."
"414","MHHW","Mean higher high water level (high tide line)",NA
"415","MHI","Main Hawaiian Islands",NA
"416","MITT","Mariana Islands Training and Testing",NA
"417","MMA","Marine Managed Area",NA
"418","MMPA","Marine Mammal Protection Act","The MMPA prohibits the harvest or harassment of marine mammals, although permits for incidental take of marine mammals while commercial fishing may be issued subject to regulation. (See ""incidental take"" for a definition of ""take"")."
"419","MOA","Memorandum of Agreement","A document written between parties to cooperatively work together on an agreed upon project or meet an agreed upon objective. The purpose of an MOA is to have a written understanding of the agreement between parties. The MOA can also be a legal document that is binding and hold the parties responsible to their commitment or just a partnership agreement."
"420","MODIS","Moderate Resolution Imaging Spectroradiometer",NA
"421","MOU","Memorandum of Understanding","A document describing a bilateral or multilateral agreement between parties. It expresses a convergence of will between the parties, indicating an intended common line of action. It most often is used in cases where parties do not intend to imply a legal commitment. It is a more formal alternative to a gentlemen's agreement."
"422","MPA","marine protected area",NA
"423","MPCC","Marine Planning and Climate Change",NA
"424","MPCCC","Marine Planning and Climate Change Committee",NA
"425","MRA","Maximum retainable allowance",NA
"426","MREP","Marine Resource Education Program",NA
"427","MRFSS","Marine Recreational Fisheries Statistics Survey","A national survey conducted by National Marine Fisheries Service to estimate the impact of recreational fishing on marine resources."
"428","MRIP","Marine Recreational Information Program","An ongoing recreational data collection and reporting effort that replaces the MRFSS program that began in the 1970s. MRIP was initiated in 2007 by NOAA Fisheries and a broad collection of scientists, managers, fishermen and others with a stake in sustainable, abundant ocean resources (estimates the number, catch, and effort of recreational fishermen)."
"429","MRIP","Marine Recreational Information Program","federal program by which NOAA Fisheries collects, analyzes and reports fishery-dependent information, or data gathered from recreational anglers"
"430","MS","Mothership",NA
"431","MSA","Magnuson-Stevens Act","This act, also known as the ""Magnuson-Stevens Fishery Conservation and Management Act,"" established the 200-mile fishery conservation zone, the regional fishery management council system, and other provisions of U.S. marine fishery law."
"432","MSC","Management and Science Committee","The principal scientific advisory body of the ASMFC, comprised of representatives from member states, NMFS, and USFWS."
"433","MSE","Management strategy evaluation",NA
"434","MSRA","Magnuson-Stevens Fishery Conservation and Management Reauthorization Act",NA
"435","MSST","Minimum stock size threshold","A threshold biomass used to determine if a stock is overfished. The Council proxy for MSST is B25%."
"436","MSST","Maximum Stock Size Threshold",NA
"437","MSTC","Multispecies Technical Committee","An ASMFC committee tasked with assisting the ISFMP Policy Board on multispecies modeling efforts and facilitating movement towards the use of multispecies model results in management decisions."
"438","MSVPA","Multispecies virtual population analysis","A series of single-species age- structured stock assessment models (VPAs) linked by a simple feeding model and used to calculate natural mortality rates. The goal of the MSVPA is to evaluate fisheries management decisions at the ecosystem level."
"439","MSVPA-X","Expanded multispecies virtual population analysis","An enhanced version of the MSVPA that includes more complex predator-prey interactions and more flexible options for building single-species VPAs."
"440","MSY","Maximum Sustainable Yield","The largest catch that can be taken from a stock over time under existing environmental conditions without curtailing the ability of the stock to replace itself."
"441","MSY","Maximum sustainable yield","An estimate of the largest average annual catch or yield that can be continuously taken over a long period from a stock under prevailing ecological and environmental conditions. Since MSY is a long-term average, it need not be specified annually, but may be reassessed periodically based on the best scientific information available."
"442","MUS","Management Unit Species",NA
"443","MW","Megawatt",NA
"444","Mid-Atlantic Council","Mid-Atlantic Fishery Management Council",NA
"445","NAFO","Northwest Atlantic Fisheries Organization viii",NA
"446","NAO","NOAA Administrative Order",NA
"447","NBBTA","Northern Bristol Bay Trawl Area",NA
"448","NBSRA","Norther Bering Sea Research Area",NA
"449","NC","North Carolina",NA
"450","NCADAC","National Climate Assessment and Development Advisory Committee",NA
"451","NCDC","National Climatic Data Center",NA
"452","NCDENR","North Carolina Department of Environment and Natural Resources",NA
"453","NCDMF","North Carolina Division of Marine Fisheries",NA
"454","NCEI","National Centers for Environmental Information, NOAA",NA
"455","NCRMP","National Coral Reef Monitoring Program",NA
"456","NE","Northeast",NA
"457","NEAMAP","Northeast Area Monitoring and Assessment Program","A cooperative state/federal fisheries independent research and data collection program implemented between the Gulf of Maine and Cape Hatteras, NC."
"458","NEFMC","New England Fishery Management Council","One of eight regional fishery management councils established by the Magnuson Act that are responsible for management of fisheries in federal waters (3-200 miles from shore)."
"459","NEFSC","Northeast Fisheries Science Center","NMFS' fisheries research and science arms."
"460","NELHA","Natural Energy Laboratory of Hawaii Authority",NA
"461","NEPA","National Environmental Policy Act","Passed by Congress in 1969, NEPA requires Federal agencies to consider the environment when making decisions regarding their programs. Section 102(2)(C) requires Federal agencies to prepare an Environmental Impact Statement (EIS) before taking major Federal actions that may significantly affect the quality of the human environment. The EIS includes: the environmental impact of the proposed action, any adverse environmental effects which cannot be avoided should the proposed action be implemented, alternatives to the proposed action, the relationship between local short-term uses of the environment and long-term productivity, and any irreversible commitments of resources which would be involved in the proposed action should it be implemented."
"462","NESDIS","National Environmental Satellite, Data, and Information Service",NA
"463","NFWF","National Fish and Wildlife Foundation","One of the world's largest conservation grant-makers, providing funding to support both the public and private sectors to protect and restore the nation's fish, wildlife, plants and habitats."
"464","NGO","Non-Governmental Organization",NA
"465","NH","New Hampshire",NA
"466","NIDP","Notice of Intent to Deny Permit",NA
"467","NJ","New Jersey",NA
"468","NLAA","Not likely to adversely affect",NA
"469","NMFS","National Marine Fisheries Service","The service within NOAA dedicated to the stewardship of living marine resources through science-based conservation and management, and the promotion of healthy ecosystems; also known as NOAA Fisheries Service."
"470","NMFS","National Marine Fisheries Service","A division of the U.S. Department of Commerce, National Oceanic and Atmospheric Administration (NOAA). NMFS is responsible for conservation and management of offshore fisheries (and inland salmon). The NMFS Regional Director is a voting member of the Council."
"471","NMFS NWFSC","National Marine Fisheries Service Northwest Fisheries Science Center",NA
"472","NMFS NWR","National Marine Fisheries Service Northwest Region",NA
"473","NMFS SWR","National Marine Fisheries Service Southwest Region",NA
"474","NMFS WCR","National Marine Fisheries Service West Coast Region",NA
"475","NMS","National Marine Sanctuary",NA
"476","NMSA","National Marine Sanctuaries Act",NA
"477","NMSAS","National Marine Sanctuary of American Samoa",NA
"478","NMSP","National Marine Sanctuaries Program",NA
"479","NOAA","National Oceanic & Atmospheric Administration","The parent agency of National Marine Fisheries Service."
"480","NOAA","National Oceanic and Atmospheric Administration","A federal agency within the Department of Commerce focused on the condition of the oceans and the atmosphere."
"481","NOAA GC","NOAA General Counsel",NA
"482","NOAAS","NOAA ship",NA
"483","NOI","Notice of Intent",NA
"484","NOPS","Notice Of Permit Sanctions",NA
"485","NOR","net operating revenue",NA
"486","NORPAC","North Pacific Database Program",NA
"487","NOS","National Ocean Service",NA
"488","NOVA","Notice Of Violation and Assessment",NA
"489","NPAFC","North Pacific Anadromous Fish Commission",NA
"490","NPCC","Northwest Power and Conservation Council (formerly known as the Northwest Power Planning Council)",NA
"491","NPDES","National Pollutant Discharge Elimination System",NA
"492","NPFMC","North Pacific Fishery Management Council","The NPFMC consists of the state of Alaska, with representation by Washington and Oregon."
"493","NPOA","National Plan of Action",NA
"494","NPPSD","North Pacific Pelagic Seabird Database",NA
"495","NRC","National Research Council",NA
"496","NRCC","Northeast Regional Coordinating Council",NA
"497","NRDC","Natural Resources Defense Council",NA
"498","NS","National Standard",NA
"499","NSAR","National Saltwater Angler Registry",NA
"500","NSF","National Science Foundation",NA
"501","NSG","National Standard Guidelines","Guidelines issued by National Marine Fisheries Service to provide comprehensive guidance for the development of fishery management plans and amendments that comply with the national standards of the Magnuson-Stevens Act. These guidelines are found in Title 50, Code of Federal Regulations, part 600."
"502","NSRKC","Norton Sound Red King Crab",NA
"503","NWFSC","Northwest Fisheries Science Center","In Seattle; a division of NMFS"
"504","NWHI","Northwestern Hawaiian Islands","All islands in the Hawaiian Archipelago, other than the Main Hawaiian Islands (MHI)"
"505","NWIFC","Northwest Indian Fisheries Commission",NA
"506","NWR","National Wildlife Refuge",NA
"507","NWR","Northwest Region",NA
"508","NY","New York",NA
"509","OA","Open-access fishery","The segment of the groundfish fishery or any other fishery for which entry is not controlled by a limited entry permitting program."
"510","OA","operational assessment",NA
"511","OC-CCI","Ocean Color Climate Change Initiative",NA
"512","OCC","Outer Cape Cod","A management area designated under Amendment 3 to the American Lobster FMP."
"513","OCN","Oregon coastal natural (coho)",NA
"514","OCNMS","Olympic Coast National Marine Sanctuary",NA
"515","OCZMA","Oregon Coast Zone Management Act",NA
"516","ODFW","Oregon Department of Fish and Wildlife",NA
"517","OECA","Oculina Experimental Closed Area",NA
"518","OEG","Optimal escapement goal",NA
"519","OEIS","Overseas Environmental Impact Statement",NA
"520","OFL","Overfishing Limit","The estimate of the catch level above which overfishing is occurring."
"521","OFP-SPC","Oceanic Fisheries Program of the Secretariat of the Pacific Community",NA
"522","OHAPC","Oculina Habitat Area of Particular Concern",NA
"523","OLE","Office of Law Enforcement",NA
"524","OMB","Office of Management and Budget",NA
"525","ONI","Oceanic Niño Index",NA
"526","OR","Oregon",NA
"527","OSP","Optimum sustainable production, Oregon State Police",NA
"528","OST","Office of Science and Technology",NA
"529","OSU","Oregon State University",NA
"530","OSWAG","Other Shallow-water Grouper",NA
"531","OTEC","Ocean Thermal Energy Conversion",NA
"532","OY","Optimum Yield","The long-term average amount of desired yield (greatest overall benefit to the nation) from a stock, stock complex, or fishery. Because the population size of fish stock fluctuates every year, the amount of fish that is available to the fishery in any given year may be above or below."
"533","OY","Optimum yield","The amount of fish that will provide the greatest overall benefit to the Nation, particularly with respect to food production and recreational opportunities, and taking into account the protection of marine ecosystems. The OY is developed on the basis of the Maximum Sustained Yield from the fishery, taking into account relevant economic, social, and ecological factors. In the case of overfished fisheries, the OY provides for rebuilding to a level that is consistent with producing the Maximum Sustained Yield for the fishery."
"534","Observer Program","North Pacific Groundfish Observer Program",NA
