"","Acronym","Meaning","Definition"
"1","AA","Annual Allocation",NA
"2","AAC","Alaska Administrative Code",NA
"3","ABC","Acceptable Biological Catch","A scientific calculation of the annual catch level recommended by a Council's SSC and is used to set the upper limit of the annual total allowable catch. It is calculated by applying the estimated (or proxy) harvest rate that produces maximum sustainable yield to the estimated exploitable stock biomass (the portion of the fish population that can be harvested)."
"4","ABM","Abundance-Based Management",NA
"5","ACCSP","Atlantic Coastal Cooperative Statistics Program","A cooperative state- federal program to design, implement, and conduct marine fisheries statistics data collection programs and to integrate those data into a single data management system that will meet the needs of fishery managers, scientists, and fishermen."
"6","ACE","Annual Catch Entitlement",NA
"7","ACFCMA","Atlantic Coastal Fisheries Cooperative Management Act","Federal legislation, passed in December 1993 that provides a mechanism to ensure Atlantic coastal state compliance with mandated conservation measures in Commission-approved fishery management plans."
"8","ACFHP","Atlantic Coastal Fish Habitat Partnership","A partnership of state, federal, local, and non-governmental entities aimed at protecting, restoring, and enhancing fish and aquatic communities along the Atlantic coast."
"9","ACL","Annual Catch Limits","The level of annual catch of a stock or stock complex that serves as the basis for invoking [accountability measures]. ACL cannot exceed the ABC, but may be divided into sector-ACLs."
"10","ACLG","Annual Catch Limit Working Group",NA
"11","ACT","annual catch target","set below the ACL at a level to ensure the ACL is not exceeded and to account for management uncertainty"
"12","ADCNR","Alabama Department of Conservation and Natural Resources","Alabama's state agency for the management and conservation of wildlife and aquatic resources"
"13","ADFG","Alaska Department of Fish and Game",NA
"14","ADP","Annual Deployment Plan",NA
"15","AEQ","Adult equivalent",NA
"16","AFA","American Fisheries Act",NA
"17","AFSC","Alaska Fisheries Science Center",NA
"18","AI","Aleutian Islands",NA
"19","AIS","Aquatic invasive species",NA
"20","AK BOF","Alaska Board of Fisheries",NA
"21","AKFIN","Alaska Fisheries Information Network",NA
"22","AKR","Alaska Region",NA
"23","AKRO","Alaska Regional Office",NA
"24","ALJ","Administrative Law Judge",NA
"25","ALK","age-length-key",NA
"26","ALS","Accumulated Landings System ","data system housed by the SEFSC includes all commercial fishery data from the SE region of the U.S., commercial landings information usually reported by dealers on ""trip tickets"" to state agencies that go to regional commission databases then to this system"
"27","AM","accountability measure","management controls to prevent annual catch limits from being exceeded and to correct or mitigate overages of the annual catch limit if they occur"
"28","AMP","Adaptive Management Program",NA
"29","ANILCA","Alaska National Interest Lands Conservation Act",NA
"30","AOP","Assessment Oversight Panel",NA
"31","AP","Advisory Panel","A group of stakeholders with experience and knowledge of the regional fisheries who provide input into the management process."
"32","APA","Administrative Procedure Act","the governing process by which federal agencies develop and issue regulations. This process includes publishing in the Federal Register and the ability for the public to comment on proposed regulations"
"33","APAIS","Access Point Angler Intercept Survey","the dockside intercept portion of the federal recreational angler survey commonly known as MRIP"
"34","AR","Autoregressive","An autoregressive model specifies that the output variable depends linearly on its own previous value(s) and a stochastic term"
"35","ARM","Adaptive Resource Management Framework","A mechanism, established through Addendum VII to the Horseshoe Crab FMP, which incorporates both shorebird and horseshoe crab abundance levels to set optimized harvest levels for horseshoe crabs of Delaware Bay origin."
"36","AS","American Samoa","Includes the islands of Tutuila, Manua, Rose and Swains Atolls"
"37","ASAP","age-structured assessment program","an age-structured stock assessment model that uses various components to estimate population sizes based on observed catches, catch-at-age and indices of abundance"
"38","ASC","Assessment Science Committee","An ASMFC committee that coordinates the scheduling of species-specific stock assessments and assists the ISFMP Policy Board in setting priorities and timelines in relation to current workloads."
"39","ASG","American Samoa Government",NA
"40","ASMFC","Atlantic States Marine Fisheries Commission","An interstate compact of the 15 Atlantic coastal states with the vision of ""Sustainably managing Atlantic Coastal Fisheries"""
"41","ATM","Acoustic trawl method",NA
"42","AVHRR","Advanced Very High Resolution Radiometer",NA
"43","B","Biomass","the total weight or volume of a stock of fish; often used in conjunction with other management acronyms such as MSY"
"44","B MAX","#VALUE!","#VALUE!"
"45","B MSY","Biomass at Max Sustainable Yield","stock biomass level capable of producing an equilibrium yield at maximum sustainable yield"
"46","B-CURR","Current biomass",NA
"47","B-OY","Biomass at optimum yield",NA
"48","B1","Fish Filleted or Used for Bait but Identified by Interviewer",NA
"49","B2","Fish Identified but Released Alive",NA
"50","B25%","25% of unfished biomass (size of fish stock without fishing)","For groundfish, this is the threshold for being designated as overfished."
"51","B40%","40% of unfished biomass (size of fish stock without fishing)","This is the Council's threshold for declaring a stock rebuilt, or the size of the stock estimated to produce maximum sustainable yield. This is also referred to as BMSY."
"52","BA","Biological assessment","An assessment conducted as part of the Endangered Species Act process."
"53","BAM","Beaufort Assessment Model","Stock assessment model for South Atlantic"
"54","BASIS","Bering Sea-Aleutian Salmon International Survey",NA
"55","BB","Briefing Book","the group of materials, including documents and presentations, prepared in advance of a Council meeting to provide background information on topics that will be discussed during the meeting"
"56","BBRKC","Bristol Bay Red King Crab",NA
"57","BC","Budget Committee",NA
"58","BCURRENT","Current Biomass of Stock",NA
"59","BDCP","Bay Delta Conservation Plan",NA
"60","BEG","Biological escapement goal",NA
"61","BET","Bigeye Tuna",NA
"62","BFLAG","Warning Reference Point","Set equal to BMSY"
"63","BKC","Blue King Crab",NA
"64","BLM","Bureau of Land Management","Administers 261 million acres of public lands, mainly in the West."
"65","BM","base model","the assessment model used to perform an assessment of a stock to determine status and appropriate management measures; remains consistent with previous models used in SEDAR assessments; other supplemental analyses and models are often used in conjunction with the base model"
"66","BOEM","Bureau of Ocean Energy Management",NA
"67","BOF","Board of Fish",NA
"68","BOR","U.S. Bureau of Reclamation","Responsible for managing water distribution in the West."
"69","BPA","Bonneville Power Administration","BPA markets electricity from 31 federally-owned dams in the Columbia River basin."
"70","BRD","bycatch reduction device","a piece of equipment designed with the specific purpose of minimizing unintended capture of non-target species"
"71","BRP","Biological reference point","A particular value of stock size, catch, fishing effort, or fishing mortality that may be used as a measure of stock status or management plan effectiveness. BRP's can be categorized as limits, targets, or thresholds depending on their intended use."
"72","BSAI","Bering Sea and Aleutian Islands",NA
"73","BSFRF","Bering Sea Fisheries Research Foundation",NA
"74","BSIA","Best Scientific Information Available",NA
"75","BSIERP","Bering Sea Integrated Ecosystem Research Program",NA
"76","BTS","Bottom trawl survey",NA
"77","BiOp","biological opinion","A scientific assessment issued by various NOAA regional offices on a range of topics such as fisheries, dredging and offshore winds, these opinions essentially specify the conditions by which federal agencies must comply in order to minimize impacts from federal actions, usually for any actions that may affect ESA-listed species"
"78","Bo (B sub zero)",NA,"Unfished biomass; the estimated size of a fish stock in the absence of fishing."
"79","Board","ASMFC Summer Flounder, Scup, and Black Sea Bass Board",NA
"80","C","Catch",NA
"81","C&S","ceremonial and subsistence","A harvest category specific to native American tribes."
"82","CAMS","Catch Accounting and Monitoring System",NA
"83","CAS","Catch Accounting System",NA
"84","CBNMS","Cordell Bank National Marine Sanctuary",NA
"85","CC","Connecticut",NA
"86","CCC","Council Coordination Committee","committee made up of chairs, vice chairs, and regional directors of each regional fishery management council. The committee meets twice each year to discuss issues pertinent to all the councils"
"87","CCCT","Ad Hoc Climate and Communities Core Team",NA
"88","CCE","California Current Ecosystem",NA
"89","CCI","Climate and Commununities Initiative",NA
"90","CCIEA","California Current Integrated Ecosystem Assessment",NA
"91","CDF","cumulative distribution function",NA
"92","CDFW","California Department of Fish and Wildlife (formerly CDFG, Fish and Game)",NA
"93","CDQ","Community Development Quota",NA
"94","CEA","Cumulative Effects Analysis",NA
"95","CEC","Community Engagement Committee",NA
"96","CEQ","Council on Environmental Quality","a division of the Executive Branch that coordinates federal environmental efforts and oversees NEPA implementation"
"97","CEQA","California Environmental Quality Act",NA
"98","CESS","Committee on Economics and Social Sciences","An ASMFC committee focusing on social and economic considerations in fisheries management."
"99","CFA","Community fishing association",NA
"100","CFDBS","Commercial Fisheries Data Base System",NA
"101","CFEAI","Commercial Fishing Economic Assessment Index",NA
"102","CFL","Coastal Fisheries Logbook",NA
"103","CFLP","Commercial Fisheries Logbook Program",NA
"104","CFMC","Caribbean Fishery Management Council","one of eight regional councils, responsible for managing fishery resources in the Caribbean Exclusive Economic Zone off Puerto Rico and the U.S. Virgin Islands"
"105","CFR","Code of Federal Regulations","A codification of the regulations published in the Federal Register by the executive departments and agencies of the federal government. The CFR is divided into 50 titles that represent broad areas subject to federal regulation. Title 50 contains wildlife and fisheries regulations."
"106","CGOA","Central Gulf of Alaska",NA
"107","CH","Critical Habitat",NA
"108","CHAPC","Coral Habitat Area of Particular Concern",NA
"109","CHTS","Coastal Household Telephone Survey","survey used to collect recreational fishing effort information through random-digit dialing of residential households. Replaced by the FES survey in 2018."
"110","CI","confidence interval","upper and lower limits that bound a plausible range of values or a specified probability that a parameter value lies within this range"
"111","CIE","Center for Independent Experts",NA
"112","CINMS","Channel Islands National Marine Sanctuary","A 1,252-square-nautical-mile area of the Santa Barbara Channel designated as a marine sanctuary in 1980. It encompasses an area out to six nautical miles around the islands of San Miguel, Santa Rosa, Santa Cruz, Anacapa, and Santa Barbara. CINMS is one of 13 National Marine Sanctuaries around the country."
"113","CITES","Convention of International Trade in Endangered Species",NA
"114","CJFAS","Canadian Journal of Fisheries and Aquatic Sciences",NA
"115","CLF","Conservation Law Foundation",NA
"116","CLM","commercial landings monitoring",NA
"117","CM","continuity model",NA
"118","CML","Commercial Marine License data",NA
"119","CMM","Conservation and Management Measures",NA
"120","CMP","coastal migratory pelagics",NA
"121","CNMI","Commonwealth of the Northern Mariana Islands","Includes the islands of Saipan, Tinian, Rota, and many others in the Marianas Archipelago"
"122","CO2","Carbon Dioxide",NA
"123","COAR","Commercial Operators Annual Report",NA
"124","COBLZ","C. opilio Bycatch Limitation Zone",NA
"125","ACOE","(U.S. Army) Corps of Engineers","Among other things, the COE manages hydropower facilities, conducts dredging operations, and builds breakwaters and jetties."
"126","COI","certificate of inspection",NA
"127","COP","Council Operating Procedures",NA
"128","CP","Catcher/processor",NA
"129","CPC","Climate Prediction Center, NOAA",NA
"130","CPDF","Catch-Per-Day-Fished",NA
"131","CPFV","Commercial passenger fishing vessel","(Charter boat)"
"132","CPI","Consumer Price Index",NA
"133","CPS","coastal pelagic species","Coastal pelagic species are schooling fish, not associated with the ocean bottom, that migrate in coastal waters. They usually eat plankton and are the main food source for higher level predators such as tuna, salmon, most groundfish, and humans. Examples are herring, squid, anchovy, sardine, and mackerel."
"134","CPSAS","Coastal Pelagic Species Advisory Subpanel",NA
"135","CPSMT","Coastal Pelagic Species Management Team",NA
"136","CPUE","catch per unit of effort","The quantity of fish caught (in number or weight) with one standard unit of fishing effort. For example, the number of fish taken per 1,000 hooks per day, or the weight of fish, in tons, taken per hour of trawling. CPUE is often considered an index of fish biomass (or abundance). Sometimes referred to as catch rate. CPUE may be used as a measure of economic efficiency of fishing as well as an index of fish abundance."
"137","CQE","Community Quota Entity",NA
"138","CR","Columbia River",NA
"139","CRCA","California Rockfish Conservation Area","The California Rockfish Conservation Area (CRCA) is defined as (1) ocean waters 20 fm to 250 fm between Cape Mendocino and Point Reyes and 20 fm to 150 fm between Point Reyes and the U.S./Mexico Border, and (2) the Cowcod Conservation Areas. The purpose of the CRCA is to regulate all gear types that have a potentially significant affect on rebuilding of overfished rockfish species south of Cape Mendocino."
"140","CRD","Center Reference Document",NA
"141","CRITFC","Columbia River Inter-Tribal Fish Commission",NA
"142","CS","Consumer surplus",NA
"143","CSE","Council of Science Editors",NA
"144","CSP","Halibut Catch Sharing Plan",NA
"145","CT LISTS","Connecticut Long Island Sound Trawl Survey",NA
"146","CV","coefficient of variation",NA
"147","CVOA","Catcher vessel operational area",NA
"148","CVPIA","Central Valley Project Improvement Act",NA
"149","CWT","coded-wire tag","Coded-wire tags are small pieces of stainless steel wire that are injected into the snouts of juvenile salmon and steelhead. Each tag is etched with a binary code that identifies its release group."
"150","CY","Calendar Year",NA
"151","CZMA","Coastal Zone Management Act","The main objective of the CZMA is to encourage and assist states in developing coastal zone management programs, to coordinate state activities, and to safeguard the regional and national interests in the coastal zone. It requires that any federal activity (including fishery management regulations) directly affecting the coastal zone of a state be consistent with that state's approved coastal zone management program, since activities that take place beyond the territorial sea may affect the coastal zone."
"152","CalCOFI","California Cooperative Oceanic Fisheries Investigations",NA
"153","Covid","refers to coronavirus pandemic years",NA
"154","DAS","Days-At-Sea",NA
"155","DAWR","Division of Aquatic and Wildlife Resources, Guam",NA
"156","DEA","Draft Environmental Assessment",NA
"157","DEIS","Draft Environmental Impact Statement",NA
"158","DFO","(Canada) Department of Fisheries and Oceans",NA
"159","DFW","Department of Fish and Wildlife",NA
"160","DGN","Drift gillnet",NA
"161","DIC","Dissolved Inorganic Carbon",NA
"162","DMF","Division of Marine Fisheries",NA
"163","DMIS","Database",NA
"164","DMWR","Department of Marine and Wildlife Resources, American Samoa",NA
"165","DOC","Department of Commerce","Parent organization of the National Marine Fisheries Service."
"166","DOD","Department of Defense",NA
"167","DOI","Department of Interior",NA
"168","DOJ","Department of Justice","DOJ attorneys represent the Secretary of Commerce in litigation on fishery management plans."
"169","DOS","Department of State",NA
"170","DPNR","Department of Planning and Natural Resources of the USVI",NA
"171","DPS","Distinct population segment","A population or group of populations that is discrete from other populations of the species and significant in relation to the entire species. The Endangered Species Act provides for listing species, subspecies, or distinct population segments of vertebrate species. Atlantic sturgeon is characterized as having 3 DPSs throughout its US Atlantic coast range."
"172","DQA","Data Quality Act",NA
"173","DTL","Daily trip limit",NA
"174","DTS","Dover sole, thornyhead, and trawl-caught sablefish complex",NA
"175","DWFN","Distant Water Fishing Nation",NA
"176","DWG","deep-water grouper",NA
"177","DWH","Deepwater Horizon",NA
"178","E-A","Euro-American",NA
"179","EA","environmental assessment","As part of the National Environmental Policy Act (NEPA) process, an EA is a concise public document that provides evidence and analysis for determining whether to prepare an environmental impact statement (EIS) or a Finding of No Significant Impact."
"180","EAM","Ecosystem approach to management",NA
"181","EAS","Ecosystem Advisory Subpanel",NA
"182","EBFM","Ecosystem Based Fisheries Management",NA
"183","EBM","Ecosystem-based management",NA
"184","EC","Ecosystem component",NA
"185","ECO","Ecosystem Committee",NA
"186","ED","Executive Director",NA
"187","EDF","Environmental Defense Fund",NA
"188","EDR","Economic Data Reporting",NA
"189","EEJ","Equity and environmental justice",NA
"190","EEZ","Exclusive Economic Zone","An area of the ocean, generally extending 200 nautical miles (230 miles) beyond a nation's territorial sea, within which a coastal nation has jurisdiction over both living and nonliving resources."
"191","EF","Expansion Factor",NA
"192","EFH","essential fish habitat","Those waters and substrate necessary to fish for spawning, breeding, feeding or growth to maturity."
"193","EFH-HAPC","Essential Fish Habitat- Habitat Area of Particular Concern",NA
"194","EFHCA","Essential fish habitat conservation area",NA
"195","EFHRC","Essential Fish Habitat Review Committee",NA
"196","EFIN","Economic Fishery Information Network","Administered by the Pacific States Marine Fisheries Commission."
"197","EFMP","Ecosystem Fishery Management Plan",NA
"198","EFP","exempted fishing permit","A permit issued by National Marine Fisheries Service that allows exemptions from some regulations in order to study the effectiveness, bycatch rate, or other aspects of an experimental fishing gear. Previously known as an ""experimental fishing permit."""
"199","EIR","Environmental impact review",NA
"200","EIS","Environmental impact statement","As part of the National Environmental Policy Act (NEPA) process, an EIS is an analysis of the expected impacts resulting from the implementation of a fisheries management or development plan (or some other proposed action) on the environment. EISs are required for all fishery management plans as well as significant amendments to existing plans. The purpose of an EIS is to ensure the fishery management plan gives appropriate consideration to environmental values in order to prevent harm to the environment."
"201","EJ","environmental justice",NA
"202","ELAPS","Effort Limit Area for Purse Seine",NA
"203","ELB","electronic logbook",NA
"204","ELMR","Estuarine Living Marine Resources",NA
"205","EM","Electronic monitoring",NA
"206","EMC","Electronic Monitoring Committee",NA
"207","ENSO","El Niño Southern Oscillation","Abnormally warm ocean climate conditions, which in some years affect the eastern coast of Latin America (centered on Peru) often around Christmas time. The anomaly is accompanied by dramatic changes in species abundance and distribution, higher local rainfall and flooding, and massive deaths of fish and their predators. Many other climactic anomalies around the world are attributed to consequences of El Nino."
"208","EO","Executive Order",NA
"209","EPA","Environmental Protection Agency",NA
"210","EPDT","Ecosystem Plan Development Team",NA
"211","EPO","Eastern Pacific Ocean",NA
"212","EPR","Eggs per recruit","The expected egg production from a female in her lifetime, usually expressed as a percentage of the egg production that would otherwise occur in an unfished stock."
"213","ER","ecological reserve",NA
"214","ESA","Endangered Species Act","An act of Federal law that provides for the conservation of endangered and threatened species of fish, wildlife, and plants. When preparing fishery management plans, councils are required to consult with the National Marine Fisheries Service and the U.S. Fish and Wildlife Service to determine whether the fishing under a fishery management plan is likely to jeopardize the continued existence of an ESA-listed species or to result in harm to its critical habitat."
"215","ESD","Equivalent Spherical Diameter",NA
"216","ESP","Ecological and Socioeconomic Profile",NA
"217","ESRL","Earth System Research Laboratory, NOAA",NA
"218","ESU","evolutionarily significant unit","An Evolutionarily Significant Unit or ""ESU"" is a distinctive group of Pacific salmon, steelhead, or sea-run cutthroat trout that is uniquely adapted to a particular area or environment and cannot be replaced."
"219","EWG","Ecosystem Workgroup",NA
"220","F","Fishing mortality","The rate at which fish die due to fishing activities."
"221","F MAX","F MAX","fishing mortality rate corresponding to maximum yield-per-recruit"
"222","F-30% SPR","Fishing mortality at spawning potential ratio (SPR) = 30%",NA
"223","F-CURR","Current instantaneous rate of fishing mortality",NA
"224","F-MSY","The rate of fishing mortality expected to achieve MSY under equilibrium",NA
"225","F-OY","The rate of fishing mortality expected to achieve MSY under an equilibrium",NA
"226","F/V","Fishing vessel",NA
"227","F30% SPR","fishing mortality corresponding to 30% spawning potential ratio",NA
"228","F=0",NA,"No fishing."
"229","FAC","Fisheries Advisory Committee",NA
"230","FAD","Fish aggregating device","Artificial or natural floating objects placed on the ocean surface, often anchored to the bottom, to attract several schooling fish species underneath, thus increasing their catchability."
"231","FAO","Food & Agriculture Organization of the United Nations",NA
"232","FATE","Fisheries and the Environment",NA
"233","FCURR","Current Fishing Mortality Rate",NA
"234","FDA","Food and Drug Administration",NA
"235","FDM","Farallon de Medinilla, CNMI",NA
"236","FEIS","Final Environmental Impact Statement",NA
"237","FEP","Fishery Ecosystem Plan",NA
"238","FERC","Federal Energy Regulatory Commission","Regulates hydropower operations and offshore wave energy."
"239","FES","Fishing Effort Survey","Recreational fishing statistics"
"240","FGTWG","Fishing Gear Technology Work Group","An ASMFC committee focusing on fishing gear technology and bycatch reduction."
"241","FHS","for-hire-survey",NA
"242","FIN","Fisheries Information Network",NA
"243","FIS","Fishery Impact Statement",NA
"244","FKNMS","Florida Keys National Marine Sanctuary",NA
"245","FL","Fork length","A measurement used frequently for fish length when the tail has a fork shape. Projected straight distance between the tip of the fish and the fork of the tail."
"246","FLEC","Florida East Coast",NA
"247","FLL","Freezer longliner",NA
"248","FMA","AFSC Fisheries Monitoring and Analysis Division (aka the Observer Program)",NA
"249","FMAC","Fishery Monitoring Advisory Committee",NA
"250","FMC","Fishery management council","A fisheries management body established by the Magnuson-Stevens Act to manage fishery resources in designated regions of the United States. Membership varies in size depending on the number of states involved. There are eight regional Councils, including the Pacific Council."
"251","FMP","Fishery management plan","A plan, and its amendments, that contains measures for conserving and managing specific fisheries and fish stocks."
"252","FMSY","FMSY","fishing mortality rate corresponding to an equilibrium yield at maximum sustainable yield"
"253","FMSY",NA,"The fishing mortality rate that maximizes catch biomass in the long term."
"254","FMSY","Fishing Mortality at MSY",NA
"255","FMU","Fishery Management Unit",NA
"256","FOIA","Freedom of Information Act",NA
"257","FONSI","Finding of no significant impact","As part of the National Environmental Policy Act (NEPA) process, a finding of no significant impact (FONSI) is a document that explains why an action that is not otherwise excluded from the NEPA process, and for which an environmental impact statement (EIS) will not be prepared, will not have a significant effect on the human environment."
"258","FOY","FOY","fishing mortality rate corresponding to an equilibrium yield at optimum"
"259","FOY","Fishing Mortality Rate Yielding OY",NA
"260","FPR","Fishery performance reports",NA
"261","FR","Federal Register","The Federal Register is the official daily publication for Rules, Proposed Rules, and Notices of Federal agencies and organizations, as well as Executive Orders and other Presidential documents. Fisheries regulations are not considered final until they are published in the Federal Register."
"262","FR","Federal Regulations",NA
