"","Acronym","Meaning","Definition"
"535","P*","P-star","Probability of overfishing"
"536","PBF","Pacific Bluefin Tuna",NA
"537","PBR","Potential biological removal","The maximum number of animals, not including natural mortalities, that may be removed from a marine mammal stock while allowing that stock to reach or maintain its optimum sustainable population."
"538","PCE","Primary Constituent Element",NA
"539","PCFFA","Pacific Coast Federation of Fishermen's Associations",NA
"540","PDF","probability density function","used to generate the P*"
"541","PDO","Pacific decadal oscillation","A long-term, El Nino-like pattern of Pacific Ocean climate variability."
"542","PDT","Plan Development Team","group of individuals who are knowledgeable concerning the scientific facts and fishery management issues concerning a designated fish stock and who are appointed and convened by a Management Board to prepare an FMP or amendment and its supporting Source Document."
"543","PEEC","Preview of Economic and Ecological Conditions",NA
"544","PEIS","Programmatic Environmental Impact Statement","An EIS that applies to an entire program or management regime, rather than a specific action."
"545","PFMC","Pacific Fishery Management Council",NA
"546","PIBKC","Pribilof Island Blue King Crab",NA
"547","PICTs","Pacific Island Countries and Territories",NA
"548","PID","Public Information Document","A document of the ASMFC which contains preliminary discussions of biological, environmental, social, and economic information, fishery issues, and potential management options for a proposed FMP or amendment."
"549","PIE rule","Program Improvements and Enhancements rule",NA
"550","PIFSC","Pacific Islands Fisheries Science Center",NA
"551","PIGKC","Pribilof Island Golden King Crab",NA
"552","PIHCZ","Pribilof Islands Habitat Conservation Zone",NA
"553","PIMS","Permits Information Management Systems",NA
"554","PIRKC","Pribilof Islands Red King Crab",NA
"555","PIRO","Pacific Islands Regional Office, National Marine Fisheries Service",NA
"556","PMAX",NA,"The estimated probability of reaching TMAX. May not be less than 50%."
"557","PMUS","Pacific Pelagic Management Unit Species","Species managed under the Pelagic FEP"
"558","PNW","Pacific Northwest",NA
"559","POC","point of contact",NA
"560","POES","Polar Operational Environmental Satellites",NA
"561","POP","Pacific ocean perch",NA
"562","PPA","Preliminary preferred alternative",NA
"563","PPGFA","Pago Pago Game Fishing Association",NA
"564","PPS","proportional probability sampling",NA
"565","PPT","Pelagic Fishery Ecosystem Plan Team",NA
"566","PR","Puerto Rico",NA
"567","PRA","Paperwork Reduction Act",NA
"568","PRD","Protected Resources Division",NA
"569","PRD","Protected Resources Division of Southeast Regional Office",NA
"570","PRDNER","Puerto Rico Department of Natural and Environmental Resources",NA
"571","PRFC","Potomac River Fisheries Commission","An interstate compact of the states of Maryland and Virginia charged with coordinating the regulation of the fisheries of the main stem of the tidal Potomac River."
"572","PRIA","Pacific Remote Island Areas",NA
"573","PRT","Plan Review Team","The portion of a stock caught by a single unit of fishing effort."
"574","PS","producer surplus",NA
"575","PSA","productivity-susceptibility analyses",NA
"576","PSC","Pacific Salmon Commission",NA
"577","PSC","Prohibited Species Catch",NA
"578","PSE","Proportional Standard Error",NA
"579","PSEIS","Programmatic Supplemental Environmental Impact Statement",NA
"580","PSMFC","Pacific States Marine Fisheries Commission","The PSMFC is a non-regulatory agency that serves Alaska, California, Idaho, Oregon and Washington. PSMFC (headquartered in Portland) provides a communication exchange between the Pacific Fishery Management Council and the North Pacific Fishery Management Council, and a mechanism for Federal funding of regional fishery projects. The PSMFC provides information in the form of data services for various fisheries."
"581","PST","Pacific Salmon Treaty","Created in 1985 through cooperative efforts of tribes, state governments, U.S. and Canadian governments, and sport and commercial fishing interests. The Pacific Salmon Commission (PSC) was created to implement the treaty. The PSC establishes fishery and allocation regimes, develops management recommendations and is a forum for working on fishery issues."
"582","PT","Plan Team",NA
"583","PWS","Prince William Sound",NA
"584","PacFIN","Pacific Coast Fisheries Information Network","Provides commercial fishery information for Washington, Oregon, and California. Maintained by the Pacific States Marine Fisheries Commission."
"585","PlanBsmooth","Plan B' model using log-linear regression and Loess smoothing",NA
"586","PopDy","Population Dynamics Branch of NEFSC",NA
"587","QA/QC","Quality Assurance/Quality Control",NA
"588","QP","Quota pounds",NA
"589","QS","Quota share","A share of the Total Allowable Catch (TAC) allocated to an operating unit such as a vessel, a company or an individual fisherman (individual quota) depending on the system of allocation. Quotas may or may not be transferable, inheritable, and tradable. While generally used to allocate total allowable catch, quotas could be used also to allocate fishing effort or biomass."
"590","QUEST","Quantitative Ecology and Socioeconomics Training, NOAA program",NA
"591","R",NA,"programming environment for statistical processing and presentation"
"592","R/S","recruits-per-spawner",NA
"593","R/V","Research vessel",NA
"594","RA","Regional Administrator of NMFS",NA
"595","RCA","Rockfish Conservation Area, riparian conservation area",NA
"596","REFM","Resource Ecology Fisheries Management",NA
"597","RER","Recovery Exploitation Rates",NA
"598","RF","Reef Fish",NA
"599","RF","Rockfish",NA
"600","RFA","Regulatory Flexibility Analysis (or Act)","Regulatory Flexibility Act. The Regulatory Flexibility Act (5 U.S.C. 601-612) requires federal agencies to consider the effects of their regulatory actions on small businesses and other small entities and to minimize any undue disproportionate burden."
"601","RFAA","Regulatory Flexibility Act Analysis",NA
"602","RFFA","Reasonably foreseeable future action",NA
"603","RFMA","Regional Fishery Management Agreements",NA
"604","RFMO","Regional Fishery Management Organization",NA
"605","RHL","Recreational harvest limit","A measure that sets an upper limit for annual recreational harvest for species that are jointly managed by the ASMFC and Regional Management Councils."
"606","RI","Rhode Island",NA
"607","RI DFW","Rhode Island Department of Fish and Wildlife",NA
"608","RIMPAC","Rim of the Pacific",NA
"609","RIR","Regulatory Impact Review","RIRs are prepared to determine whether a proposed regulatory action is ""major."" The RIR examines alternative management measures and their economic impacts."
"610","RKC","Red King Crab",NA
"611","ROA","Range of alternatives",NA
"612","ROD","Record of Decision",NA
"613","ROFR","Right of First Refusal",NA
"614","ROV","Remotely operated vehicle","E.g., a submarine"
"615","RPA","Reasonable and prudent alternative",NA
"616","RPB","Regional Planning Body",NA
"617","RPM","reasonable and prudent measures",NA
"618","RQ","regional quotient",NA
"619","RQE","Recreational Quota Entity",NA
"620","RSW","Refrigerated seawater",NA
"621","RTA","Research Track Assessment",NA
"622","RVC","Reef Visual Census","Fishery independent study that collects data on both juvenile and adult life stages"
"623","RecFin","Recreational Fishery Information Network","A database managed by the Pacific States Marine Fisheries Commission that provides recreational fishery information for Washington, Oregon, and California."
"624","S-K","Saltonstall-Kennedy Act","The Saltonstall-Kennedy Act allocates 30% of the duties for imported fishery products to technological, biological, marketing, and other research and services in order to promote the free flow of domestically-produced fishery products and to develop markets for domestic fishery products."
"625","S-R","Stock-recruitment curve","A classic discrete population model which gives the expected number of individuals in generation (e.g., recruitment) as a function of the number of individuals in the previous generation (e.g., spawning stock biomass."
"626","SA","Spawning Abundance",NA
"627","SA","Subarea as specified by NAFO",NA
"628","SADL","South Atlantic Deepwater Longline Survey",NA
"629","SAFE","Stock Assessment and Fishery Evaluation","A SAFE document is a document prepared by the Council that provides a summary of the most recent biological condition of species in the fishery management unit, and the social and economic condition of the recreational and commercial fishing industries, including the fish processing sector. It summarizes, on a periodic basis, the best available information concerning the past, present, and possible future condition of the stocks and fisheries managed in the FMP."
"630","SAFIS","Standard Atlantic Fisheries Information System",NA
"631","SAFMC","South Atlantic Fishery Management Council","One of eight regional fishery management councils established by the Magnuson Act that are responsible for management of fisheries in federal waters (3-200 miles from shore)."
"632","SAMSY","Spawning Abundance at MSY",NA
"633","SAP","Stock Assessment Panel",NA
"634","SAR","Stock Assessment Report",NA
"635","SAS","Salmon Advisory Subpanel",NA
"636","SAS","Statistical Analysis Software application viii",NA
"637","SASC","Stock Assessment Subcommittee","A group of persons who are expert in stock assessment methodologies and scientific/technical matters relating to a specific fish stock. The SASC is jointly appointed by the ASC and the species technical committee, with membership consisting of a combination of SAC members and technical committee members. The Subcommittee is responsible for conducting the species assessment and reports directly to the species technical committee."
"638","SAW","Stock Assessment Workshop",NA
"639","SAW/SARC","The Northeast Regional Stock Assessment Workshop and Stock Assessment Review Committee, respectively","The SAW is a formal scientific peer-review process for evaluating and presenting stock assessment results to managers for fish stocks of the Northwest Atlantic. Assessments are prepared by SAW working groups and reviewed by an independent panel of stock assessment experts called the SARC."
"640","SB","Spawning Biomass",NA
"641","SBA","Small Business Act",NA
"642","SBA","Small Business Administration",NA
"643","SBMSY","Spawning Biomass at MSY",NA
"644","SBRM","Standard Bycatch Reporting Methodology",NA
"645","SC","Standing Committee of the Western and Central Pacific Fisheries Commission",NA
"646","SCA","Statistical catch at age","Age-based stock assessment methods utilizing catch-at-age data to derive estimates of population size and fishing mortality. However, unlike VPA, SCAA model parameters are estimated by working forward in time, rather than backwards as is done in VPA analysis."
"647","SCDNR","South Carolina Department of Natural Resources",NA
"648","SCS","Small coastal shark complex","A shark species grouping that includes Atlantic sharpnose, finetooth and bonnethead sharks."
"649","SDC","status determination criteria",NA
"650","SEAMAP","Southeast Area Monitoring and Assessment Program","A cooperative state, federal, and university program for the collection, management, and dissemination of fishery-independent data and information in the Southeastern US and Caribbean."
"651","SECOORA","Southeast Coastal Ocean Observing Regional Association",NA
"652","SEDAR","Southeast Data, Assessment, and Review","The stock assessment peer- review process used by the South Atlantic, Gulf of Mexico, and Caribbean Fishery Management Councils, and the ASMFC to improve the quality and reliability of fishery stock assessments in the US Southeast."
"653","SEDAR","Southeast Data, Assessment, and Review","a cooperative process among the Southeast Regional Fishery Management Councils, NOAA Fisheries and the Interstate Fisheries Commissions with the goal to improve the quality and reliability of fishery resource assessments within the southeastern U.S."
"654","SEFSC","Southeast Fisheries Science Center","NMFS' fisheries research and science arms."
"655","SEFSC","Southeast Fisheries Science Center","headquartered in Miami, the Center conducts a variety of research to inform marine resource management in the Gulf of Mexico, Caribbean and South Atlantic."
"656","SEG","Sustainable escapement goal",NA
"657","SEIS","supplemental environmental impact statement","reviews the results of an existing environmental impact statement by considering new or additional environmental impacts"
"658","SEP","Socioeconomic Panel","panel of members within the scientific and statistical committees who are knowledgeable about the social and economic aspects of Gulf of Mexico fisheries"
"659","SERFS","Southeast Reef Fish Survey",NA
"660","SERO","Southeast Regional Office","Office located in St. Petersburg, Florida, operating under NOAA Fisheries, works with scientists and fisheries managers to safeguard sustainable fishing practices, protect endangered species and marine mammals and conserve marine habitats"
"661","SESSC","Socioeconomic Scientific and Statistical Committee","panel of members within the scientific and statistical committees who are knowledgeable about the social and economic aspects of Gulf of Mexico fisheries"
"662","SET","Sustainable escapement threshold",NA
"663","SEZ","Southern Exclusion Zone, Hawaii",NA
"664","SFA","Sustainable Fisheries Act","amendment to the Magnuson-Stevens Fishery Conservation and Management Act to bolster requirements to prevent overfishing, set standards for fishery management plans to specify measures for stock status determinations, added three new national standards to address fishery concerns, and introduced habitat as integral to fisheries management"
"665","SFA","Saipan Fishermen's Association",NA
"666","SFD","Sustainable Fisheries Division, NMFS PIRO",NA
"667","SFM","Shortfin Mako shark",NA
"668","SFO","Sustainable Fisheries Office (NMFS)",NA
"669","SFTFA","St. Thomas Fishermen's Association",NA
"670","SG","Snapper grouper",NA
"671","SHARKWG","Shark Working Group, ISC",NA
"672","SIA","Social Impact Assessment","similar to environmental impact assessments, it is a method of assessing cultural and social impacts from alternative fishery management actions or policies"
"673","SIA","Social impact analysis",NA
"674","SIR","Supplemental Information Report",NA
"675","SMAST","School for Marine Science and Technology (New Bedford, Maine)",NA
"676","SMBKC","St. Matthews Blue King Crab",NA
"677","SMP","System Management Plan (for protected areas)",NA
"678","SMZ","special management zone","designation of an area within artificial reef sites that prohibits the use of some fishing gear to prevent overexploitation of species but acts as an incentive to increase fish populations in an area and/or fishing opportunities that did not previously exist"
"679","SNE","Southern New England","Used to describe a population segment of the American lobster resource."
"680","SNE/MA","Southern New England/Mid-Atlantic","Used to describe a population segment of the winter flounder resource."
"681","SNEMA","Southern New England and Mid-Atlantic Bight",NA
"682","SNP","Single nucleotide polymorphism",NA
"683","SOFI","Statement of Financial Interest","a form asking questions pertaining to financial interests and disclosures given to voting members of regional fishery management councils, SSC members and Council staff as required by the Magnuson-Stevens Act. The purpose of the report is to assist the involved parties with avoiding conflicts between official duties and private financial interests or affiliations"
"684","SOI","#VALUE!","Statistics of income"
"685","SONCC","Southern Oregon Northern California coastal coho (an evolutionarily significant unit)",NA
"686","SONCCWG","Ad Hoc Southern Oregon Northern California Coast Coho Workgroup",NA
"687","SOPP","Statement of Organization, Practices, and Procedures",NA
"688","SOW","statement of work","a project management document that describes step-wise, the project's work requirements including deliverables, methods and timelines"
"689","SPA","sanctuary preservation area","a distinct biologically important area that helps sustain critical marine species and habitats."
"690","SPC","Secretariat of the Pacific Community","A technical assistance organization comprising the independent island states of the tropical Pacific Ocean, dependent territories and the metropolitan countries of Australia, New Zealand, USA, and France; now Pacific Community"
"691","SPLASH","Structure of Populations, Levels of Abundance, and Status of Humpbacks",NA
"692","SPR","Spawning potential ratio","A biological index used to assess red drum stock status."
"693","SPR","spawning potential ratio","the ratio of the number of eggs that could be produced by a fish over its lifetime that has recruited to a fishery, over the number of eggs that could be produced by an average fish in a stock that is unfished"
"694","SPR","Spawning potential ratio","The ratio of spawning potential per recruit under a given fishing regime, relative to the spawning potential per recruit with no fishing."
"695","SPR","Spawning Potential Ratio","A method to measure the effects of fishing pressure on a stock by expressing the spawning potential of the fished biomass as a percentage of the unfished virgin spawning biomass. Stocks are deemed to be overfished when the SPR<20%."
"696","SPR","Spawning biomass per recruit",NA
"697","SRD","Science and Research Director","the director of NOAA's different regional Fisheries Science Centers"
"698","SRFC","Sacramento River fall Chinook",NA
"699","SRFS","State Reef Fish Survey","Florida's supplemental reef fish survey for certain species that replaced the GRFS survey in July of 2020"
"700","SRHS","Southeast Region Headboat Survey","a federal data collection program that collects fisheries dependent data such as lengths, weights and sex from fish caught on headboat trips. The survey collects data from vessels throughout the southeast region."
"701","SRI","Sacramento River index",NA
"702","SRKW","Southern resident killer whales",NA
"703","SRKWWG","Ad Hoc Southern Resident Killer Whale Workgroup",NA
"704","SRT","Status Review Team","Used as part of the Endangered Species Act listing process."
"705","SS","stock synthesis","an age-structured population dynamics model that is used to assess the impacts of fisheries on stocks while also accounting for environmental impacts or stressors."
"706","SSB","Spawning stock biomass","The total weight of the mature females within a stock of fish; frequently used instead of total biomass as a better measure of the ability of a stock to replenish itself."
"707","SSB","spawning stock biomass","the total weight of all the fish in a stock that are old enough to reproduce, usually considered to be all fish beyond a certain age or size in which 50% of the individuals are sexually mature."
"708","SSBMSY","Spawning Stock Biomass at MSY",NA
"709","SSBMSY proxy","proxy value for spawning stock biomass estimation for maximum sustainable yield",NA
"710","SSBR","spawning stock biomass per recruit","an estimate of the lifetime reproductive potential of an average recruit. Important for examining the population growth potential of a stock"
"711","SSBTarget","theoretically ideal spawning Biomass",NA
"712","SSBThreshold","threshold for spawning stock biomass that indicates overfished status",NA
"713","SSBproxy","proxy value for spawning stock biomass estimate",NA
"714","SSC","Scientific and Statistical Committee","An advisory committee of a regional fishery management council composed of scientists, economists, and other technical experts that assist in gathering and analyzing statistical, biological, ecological, economic, social, and other scientific information that is relevant to the management of council fisheries."
"715","SSC","Scientific and Statistical Committee","a committee composed of scientists in the fields of biology, statistics, economics, the environment and social science. The committee makes recommendations to the Regional Councils on assessments and other technical matters leading to more informed fishery management decisions."
"716","SSC","Scientific and Statistical Committee","An advisory body to the Council comprising experts in fisheries, marine biology, oceanography, etc."
"717","SSFP","Sustainable Salmon Fisheries Policy",NA
"718","SSL","Steller sea lion",NA
"719","SSMZ","Spawning Special Management Zones",NA
"720","SST","Sea surface temperature",NA
"721","STAR","Stock assessment review",NA
"722","STAR Panel","Stock Assessment Review Panel","A panel set up to review stock assessments for particular fisheries. In the past there have been STAR panels for sablefish, rockfish, squid, and other species."
"723","STD","Standard Deviation",NA
"724","STDN","Sea Turtle Disentanglement Network",NA
"725","STF","Subtropical Front",NA
"726","STJ","St. Johns, U.S. Virgin Islands",NA
"727","STT","Salmon Technical Team",NA
"728","STT","St. Thomas, U.S. Virgin Islands",NA
"729","STX","St. Croix, U.S. Virgin Islands",NA
"730","SUNY","State University of New York",NA
"731","SURVEYMEANS","SAS procedure for estimating characteristics of a survey population using statistics computed from a survey sample",NA
"732","SW","Southwest",NA
"733","SWAC","Seawater Air Conditioning",NA
"734","SWFSC","Southwest Fisheries Science Center (NMFS)",NA
"735","SWG","shallow-water grouper","complex of grouper species managed in the Gulf of Mexico by the Gulf Council and NOAA Fisheries. Includes red grouper, black grouper, gag, scamp, yellowfin grouper, yellowmouth grouper, rock hind and red hind"
"736","SWG","Spatial Working Group",NA
"737","SWO","Swordfish",NA
"738","SWR","Southwest Region",NA
"739","Secretary","U.S. Secretary of Commerce",NA
"740","SoVI","social vulnerability index","14 indices that measure a coastal community's ability to respond to social, economic and environmental conditions, a useful tool for policy makers, fishery managers and interested stakeholders"
"741","TA","Total Alkalinity",NA
"742","TAC","Total Allowable Catch","The annual recommended catch by a management authority to preserve or rebuild a stock."
"743","TAC","total allowable catch","a catch limit set for a specific fishery within a set period of time, usually a year or a fishing season"
"744","TAC","Total allowable catch","The total regulated catch from a stock in a given time period, usually a year. (NMFS)"
"745","TAL","Total Allowable Landings","The annual recommended catch by a management authority to preserve or rebuild a stock."
"746","TC","Technical Committee","A group of persons who are expert in the scientific and technical matters relating to a specific fish stock and who are appointed and convened by a Management Board to provide scientific and technical advice in the process of developing and monitoring FMPs and amendments."
"747","TED","turtle excluder device","a specialized device, often used in the shrimp fishery, applied to trawl nets that allows a captured sea turtle to escape when caught."
"748","TIP","Trip Interview Program","data collected by port samplers from commercial fishermen, includes length, weight, number of fish landed, gear used and trip identifiers such as date and location"
"749","TK","Traditional Knowledge",NA
"750","TL","total length","the maximum length from mouth to tail. For example, when measuring a fish, thetotal length extends from the front of the snout with the mouth closed to the end of the longest portionof the tail fin. Some agencies compress or squeeze the tail to get this measurement."
"751","TLA","Trawl Limited Access",NA
"752","TLAS","Trawl Limited Access Sector",NA
"753","TLR","trip limit reduction","a reduction in the number or pounds of a species that can be harvested per trip"
"754","TMAX",NA,"The maximum time period to rebuild an overfished stock, according to National Standard Guidelines. Depends on biological, environmental, and legal/policy factors."
"755","TMCT","Technical Monitoring and Compliance Team",NA
"756","TMIN",NA,"The minimum time period to rebuild an overfished stock, according to National Standard Guidelines. Technically, this is the minimum amount of time in which a fish stock will have a 50% chance of rebuilding if no fishing occurs (depends on biological and environmental factors)."
"757","TNC","The Nature Conservancy",NA
"758","TOR","Terms of Reference","a list of terms that define certain aspects of a project: what has to be achieved, how and when it will be achieved and who will take part to ensure project completion"
"759","TPWD","Texas Parks and Wildlife Department","state agency that oversees and works to conserve Texas wildlife and their habitats as well as state parks, historical areas and aquatic resources."
"760","TRAC","Transboundary Resource Assessment Committee","The percent of a fish population removed by fishing over the course of a year."
"761","TRP","target reference point","a type of biological reference point, desired status of the fishery"
"762","TTARGET",NA,"The target year, set by policy, for a fish stock to be completely rebuilt."
"763","TWG","topical working group","an interdisciplinary group made of up individuals with expertise that is relevant to a certain topic"
"764","TZCF","Transition Zone Chlorophyll Front",NA
"765","TnS/TNS","Tails n' Scales","Mississippi's mandatory red snapper electronic reporting program. Voluntary reporting for other reef fish species is available"
"766","Total catch OY","Total catch optimum yield","The landed catch plus discard mortality."
"767","U.S.","United States of America",NA
"768","U.S. Caribbean","U.S. Caribbean","Caribbean islands of Puerto Rico, St. Thomas, St. John, and St. Croix"
